{
	"$schema": "../../../@schemas/model-json-schema.json#",
	"schema": "samples",
	"model": "Agent",
	"actions": {
		"index": {
			"index": true,
			"view": "index.view",
			"template": "index.template"
		}
	},
	"dialogs": {
		"editFolder": {
			"model": "Agent.Folder",
			"template": "editFolder.template",
			"view": "editFolder.dialog"
		},
		"editItem": {
			"model": "Agent.Item",
			"template": "editItem.template",
			"view": "editItem.dialog"
		},
		"browseFolder": {
			"model": "Agent",
			"index": true,
			"view": "browseFolder.dialog"
		}
	},
	"commands": {
		"deleteFolder": {
			"type": "sql",
			"procedure": "Agent.Folder.Delete"
		},
		"deleteItem": {
			"type": "sql",
			"procedure": "Agent.Item.Delete"
		},
		"getPath": {
			"type": "sql",
			"procedure": "Agent.Folder.GetPath"
		},
		"findIndex": {
			"type": "sql",
			"procedure": "Agent.Item.FindIndex"
		}
	}
}
